lg,g3 stylus,8990,black: white: gold,8 GB,LG G3 Stylus ต่อยอดจากแนวคิด Simple is the New Smart ของ LG G3 เพื่อมอบประสบการณ์การจดโน้ตรูปแบบใหม่ ด้วยหน้าจอ qHD IPS ขนาด 5.5 นิ้ว ที่มาพร้อมปากกาสไตลัส ให้สร้างสรรค์ภาพหรือจดบันทึกได้ง่ายดายกว่าการใช้ปลายนิ้วสัมผัส พร้อมกล้องหลัง 13MP
lg,l bello dual ,6880,titan black: white: gold,8 GB,LG L Bello Dual สมาร์ทโฟน 2 ซิม ที่ให้ผู้ใช้แสดงสไตล์สุดชิคผ่านความลงตัวของแฟชั่นและฟังก์ชั่นในราคาที่เป็นเจ้าของได้ง่ายๆ ด้วยหน้าจอ True IPS Display ขนาด 5 นิ้ว แบตเตอรี่ขนาด 2 540 mAh และ CPU 1.3 GHz Quad-core ให้ใช้งานได้ยาวนานไม่สะดุด มาพร้อมกับการออกแบบอย่างลงตัว แบบ Curve Design ที่ให้สัมผัสกระชับมือ 
acer,liquid x1,8990,graphite black: wine red,16 GB,สมาร์ทโฟนดีไซน์หรู รูปทรงเพรียวบางเพียง 8.5 มม. หน้าจอขนาด 5.7 นิ้ว IPS ความละเอียด 1280 x 720 พิกเซล กันรอยขีดข่วนด้วยกระจก Gorilla Glass 3 และหน่วยความจำ 16 GB และรองรับการใช้งาน Micro SD Card กล้องหลัง 13 ล้านพิกเซล พร้อมกล้องหน้า 2 ล้านพิกเซล ระบบปฏิบัติการ Android 4.4 KitKat
acer,liquid jade,6990,สีเพิร์ล อควา: สีโรส ควอตซ์: สีแซฟไฟร์: สีกลอสซี่ไวท์ และสีกลอสซี่แบล็ค,16 GB,สมาร์ทโฟนที่แสดงความเรียบหรูบางเบา และคงทน มีสีสันให้เลือกถึง 5 สีได้แก่ สีเพิร์ล อควา  สีโรส ควอตซ์  สีแซฟไฟร์  สีกลอสซี่ไวท์ และสีกลอสซี่แบล็ค ตอบโจทย์กับกลุ่มเป้าหมายที่ทันสมัยสไตล์คนรุ่นใหม่ด้วยปฏิบัติการล่าสุด Android 4.4 ที่มี 2 ซิม แสดงผลผ่านหน้าจอความละเอียด HD 1280 x 720 พิกเซล ขนาด 5 นิ้ว กันรอยขีดข่วนด้วยกระจก Gorilla Glass 3 พร้อมแรม 2 GB และหน่วยความจำภายใน 16  GB และเพิ่มเติมจาก microSD ความจุสูงถึง 32 GB
asus,padfone s,9999,titanium black: platinum white: dark ruby,16 GB,เจ้า Asus Padfone S กันก่อนดีกว่าเนอะ แว้บบบบบแรกที่น้องแป้งเห็น ทำให้รู้สึกว่าตัวเครื่องมันดูหรูหราพอสมควรเลยหล่ะ ขนาดของตัวเครื่อง 143.4 x 72.5 มม. น้ำหนักอยู่ที่ 150 กรัม ขีดนิดๆเองไม่หนักเท่าไหร่หรอกกก ความหนาของตัวเครื่องก็ประมาณ 10 มม. หรือประมาณ 0.39 นิ้วเท่านั้นเอง ก็ไม่ได้ถือว่าหนาเทอะทะอะไรมากมายเนอะ :P
vivo,xplay 3s,13990,ขาว,32 GB,ViVO XPlay 3S สมาร์ทโฟนตัวล่าสุด มาพร้อมความสามารถมากมายที่ไม่ธรรมดา อย่างเช่น หน้าจอความละเอียดคมชัดระดับ 2K (490 พิเซลต่อตารางนิ้ว) ส่วนขนาดหน้าจอคือ 6 นิ้ว   หน่วยประมวลผล Snapdragon 801   กล้องหลังความละเอียด 13 ล้านพิกเซล   กล้องหน้า 5 ล้านพร้อมแฟลช !!
vivo,y22,4490,ขาว,4 GB,Vivo Y22 ความละเอียด 480 x 854 Pixels หน้าจอกว้าง 4.5 นิ้ว แรมที่ให้มาคือ 1 GB ส่วนหน่วยความจำภายในคือ 4 GB มาพร้อมระบบปฏิบัติการ Android 4.2 และจุดเด่นคงเป็นการถ่ายรูปจากกล้องหน้าที่มีเลนส์กว้างถึง 88 องศา ทำให้ถ่ายรูปหลายๆ คนได้อย่างสบายครบทุกคน  
i-mobile,iqx ozzy,9990,ขาว,16 GB,i-mobile IQ X OZZY โดดเด่นด้วย CPU 2.0 GHz Octa-core สมาร์ทโฟนหน้าจอ 5.2 นิ้ว ความละเอียดหน้าจอ Full HD พร้อมแรม 2 GB หน่วยความจำภายใน 16 GB กล้องหลัง 18 ล้านกล้องหน้า 8 ล้านมาพร้อมระบบปฎิบัติการ แอนดรอยด์ 4.4 ในราคาไม่ถึงหมื่นนนนน
i-mobile,iqx wiz,7990,ดำ,16 GB,i-mobile IQX WIZ โดดเด่นด้วย CPU 1.3 GHz Quad-core และมาพร้อมดีไซน์สวยโฉบเฉี่ยวหน้าจอขนาด 5.5 นิ้ว ความคมชัดระดับ HD IPS พร้อมระบบปฏิบัติการแอนดรอยด์ 4.4 กล้องหลัง 18 ล้านพิกเซล และกล้องหน้า 8 ล้านพิกเซล มาพร้อมแรม 2 GB และหน่วยความจำภายในเครื่อง 16 GB 
i-mobile,iq 1.3 dtv,4990,ดำ:ขาว,8 GB,IQ 1.3 DTV สมาร์ทโฟนที่มาพร้อมฟังก์ชั่นดูทีวีระบบดิจิตอล ทำงานบนระบบปฏิบัติการ Android 4.4 หน่วยประมวลผล Quad Core ความละเอียดหน้าจอ 540 x 960 พิกเซล กว้าง 4.5 นิ้ว กล้องหลัง 8 ล้านพิกเซล กล้องหน้า 5 ล้านพิกเซล ใช้งานได้พร้อมกันสองซิม (Dual Sim) เชื่อมต่ออินเทอร์เน็ตได้ทั้ง WiFi และ 3G
i-mobile,i-style 8.3 dtv,4990,ขาว,8 GB,i-STYLE 8.3 DTV สมาร์ทโฟนที่มาพร้อมฟังก์ชั่นดูทีวีระบบดิจิตอล ทำงานบนระบบปฏิบัติการ Android 4.4 หน่วยประมวลผล Quad Core ความละเอียดหน้าจอ 480 x 854 พิกเซล กว้าง 5 นิ้ว กล้องหลัง 8 ล้านพิกเซล กล้องหน้า 5 ล้านพิกเซล ใช้งานได้พร้อมกันสองซิม (Dual Sim) เชื่อมต่ออินเทอร์เน็ตได้ทั้ง WiFi และ 3G
htc,desire eye,15990,ขาว-แดง:ขาว-ฟ้า,16 GB,HTC Desire EYE สมาร์ทโฟนเอาใจคอเซลฟี่ด้วยกล้องหน้า 13 ล้านพิกเซลเลนส์มุมกว้าง มาพร้อมกับชิปเซ็ต Snapdragon 801 Quad-core 2.3 GHz หน้าจอ 5.2 นิ้ว ความละเอียด Full-HD และลำโพงคู่แบบ Boomsound จะทำให้คุณเพลิดเพลินไปกับความบันเทิงไปอย่างเต็มรูปแบบ นอกจากกล้องหน้าจะโดดเด่นแล้วกล้องหลังก็ยังให้มาที่ 13 ล้านพิกเซลพร้อมแฟลชคู่แบบ Dual-Tone ด้วย !!
true,smart 5.0,3990,ดำ,4 GB,Smartphone จาก True ที่มาพร้อมหน้าจอขนาด 5 นิ้ว แบบ IPS Panel เพื่อความสวยสดของการรับชมทุกมุมมอง มาพร้อมกล้องถ่ายภาพความละเอียด 8 ล้านพิเซลพร้อมแฟลชและกล้องหน้า 2 ล้านพิกเซลเพื่อเอาใจคอเซลฟี่ตัวจริง ตัวเครื่องทำงานบนระบบปฎิบัติการ Android 4.4.2 KitKat พร้อมแรมขนาด 1GB
true,smart 4.0,1990,ดำ,4 GB,Smartphone จาก True ที่มาพร้อมหน้าจอขนาด 4 นิ้ว แบบ TFT-LCD ความละเอียด 800 x 480 พิกเซล พร้อมกล้องถ่ายภาพหลักที่ด้านหลังความละเอียด 5 ล้าน พิเซลพร้อมแฟลชแบบ LED และยังมีกล้องหน้าความละเอียด VGA มาเอาใจคอเซลฟี่ตัวจริง ซึ่งตัวเครื่องทำงานบนระบบปฎิบัติการ Android OS 4.4.2 KitKat พร้อมแรมขนาด 512MB รอมตัวในเครื่องขนาด 4GB
dtac,joey fit selfie 4.0,1490,ขาว:ดำ,4 GB, Joey Fit Selfie รุ่น 4.0 หน้าจอสัมผัสใหญ่ 4.0 นิ้ว ความละเอียด WVGA (800x480) กล้อง 3 ล้านพิกเซล และกล้องหน้า 1 ล้านพิกเซล พร้อมรองรับการใช้งาน 2 ซิม เร็วแรงระดับ Dual Core CPU 1.0 Ghz Android 4.4 Kit Kat หน่วยความจำภายใน 4GB พร้อม 512MB Ram แบตเตอรี่ 1 400mAh
dtac,joey fit selfie 4.5,1790,ขาว:ดำ,4 GB,Joey Fit Selfie รุ่น 4.5 หน้าจอสัมผัสใหญ่ 4.5 นิ้ว ความละเอียด 4.5"FWVGA(854X480) กล้อง 8 ล้านพิกเซล และกล้องหน้า 2 ล้านพิกเซล พร้อมรองรับการใช้งาน 2 ซิม เร็วแรงระดับ Dual Core CPU 1.3 Ghz Android 4.4 Kit Kat หน่วยความจำภายใน 4GB พร้อม 512MB Ram แบตเตอรี่ 1 850mAh
dtac,joey fit 4.0,1990,ขาว:ดำ,4 GB,Joey Fit รุ่น 4.0 หน้าจอสัมผัสใหญ่ 4.0 นิ้ว ความละเอียด WVGA (800x480) กล้อง2 ล้านพิกเซล พร้อมรองรับการใช้งาน 2 ซิม เร็วแรงระดับ Dual Core CPU 1.0 Ghz Android 4.4 Kit Kat หน่วยความจำภายใน 4GB พร้อม 512MB Ram แบตเตอรี่ 1 300mAh
dtac,happy phone 3g,659,ขาว:ดำ,ไม่มี/ไม่มีข้อมูล,Happy Phone 3G มือถือ 3G สุดคุ้ม แบตอึด ฟังวิทยุ ใช้งานครบทุก 50.- ได้แฮปปี้ใช้ฟรีคืน 50. เล่น FB ฟรี 30 วัน นาน 1 ปี เพียงเติมเงินสะสม 100.-/เดือน ค่าโทรถูก เมื่อเปิดใช้ซิมของขวัญจากแฮปปี้ที่แนบมากับเครื่องมือถือ รับประกันเครื่องนาน 15 เดือน
samsung,galaxy s duos 3,,ดำ:ขาว,4 GB,มือถือแอนดรอยด์รุ่นประหยัด Sumsung Galaxy S Duos 3 ที่รองรับ 2 ซิม ซึ่งเป็นรุ่นต่อยอดมาจาก Samsung Galaxy S Duos 2 และแน่นอนว่าต้องดีกว่ารุ่นเก่าอย่างแน่นอน จะมีอะไรเจ๋งๆบ้างไปดูพร้อมกันเลย
samsung,galaxy ace 4 lite,2990,ขาว:ดำ,4 GB,Samsung Galaxy Ace 4 Lite มาพร้อมกับโปรเซสเซอร์ 1.2 GHz  จอแสดงผล 4 นิ้ว  แบตเตอรี่ 1500 mAh และอินเทอร์เฟซผู้ใช้ TouchWiz Essence UX เพิ่มความสะดวกในการใช้งานแอพและสื่อที่คุณโปรดปรานได้อย่างเต็มที่ และเหนือกว่าด้วยระบบปฎิบัติการ KitKat 4.4
samsung,galaxy grand prime,8900,ขาว:ดำ,8 GB,Samsung Galaxy Grand Prime สมาร์ทโฟนเน้นเซลฟี่ตัวล่าสุด ด้วยกล้องหน้าความละเอียดถึง 5 ล้านพิกเซล แถมเลนส์มุมกว้าง 85 องศา จะถ่ายรูปหมู่ รูปเดียวก็สวยใส มุมเป๊ะ มาพร้อมหน้าจอ 5 นิ้ว ความละเอียด qHD หน่วยประมวลผล Snapdragon 410 Quad-core 1.2 GHz และลื่นไหลไปกับระบบปฏิบัติการ Android 4.4 Kitkat !!
samsung,galaxy a5,12900,ขาว:ดำ:เงิน:ชมพู:ฟ้า:ทอง,16 GB,Samsung Galaxy A5 สมาร์ทโฟนวัสดุโลหะตัวใหม่ล่าสุด บางเพียง 6.7 มม. มาพร้อมหน้าจอขนาด 5 นิ้วความบะเอียด HD หน่วยประมวลผล Quad-core 1.2 GHz และลื่นไหลไปกับระบบปฏิบัติการ Android 4.4 Kitkat !! กล้องหน้า 5 ล้านพิกเซลเอาใจคอเซลฟี่ กล้องหลัง 13 ล้านพิกเซล พร้อมมีสีสันให้เลือกกว่า 6 สีด้วยกัน !!
samsung,galaxy a3,,ขาว:ดำ:เงิน:ชมพู:ฟ้า:ทอง,16 GB,Samsung Galaxy A3 สมาร์ทโฟนวัสดุโลหะตัวใหม่ล่าสุด บางเพียง 6.9 มม. มาพร้อมหน้าจอขนาด 4.5 นิ้วความละเอียด qHD หน่วยประมวลผล Quad-core 1.2 GHz และลื่นไหลไปกับระบบปฏิบัติการ Android 4.4 Kitkat !! กล้องหน้า 5 ล้านพิกเซลเอาใจคอเซลฟี่ กล้องหลัง 8 ล้านพิกเซล พร้อมมีสีสันให้เลือกกว่า 6 สีด้วยกัน !!
sony,xperia e3... [[2 ซิม]],6990,ขาว : ดำ : เหลือง : ทองแดง,4 GB,เปิดตัวกันแล้วสำหรับสมาร์ทโฟน สเปคไม่แรงมากราคาย่อมเยาสามารถรองรับ 4G LTE จากค่าย Sony ต้องรุ่นนี้เลย Sony Xperia E3 ที่ติดกล้องหน้ามาที่ 3 แสน กล้องหลัง 5 ล้าน ส่วนหน่วยความจำภายในให้มา 4 GB และแรม 1 GB ระบบฏิบัติการ Android 4.4 นะจ้ะ 
oppo, n3,12990,ขาว,32 GB,Oppo N3 สมาร์ทโฟนกล้องหมุนได้รุ่นล่าสุด โดยความพิเศษของรุ่นนี้ก็จะมาพร้อมกับกล้องความละเอียด 16 ล้านพิกเซล ใช้เลนส์จาก Schneider สามารถปรับมุมมองได้มากถึง 206 องศา และมีมอเตอร์สามารถสั่งการได้ผ่านรีโมทตัวใหม่อย่าง O-Click 2 สเปคก็ใส่มาแบบจัดเต็มด้วย CPU Snapdragon 801 Quad-core 2.3 GHz   แรม 2 GB   ความจุ 32 GB แบตเตอรี่ 3000 mAh
oppo,r5,8490,เงิน:ทอง,16 GB,Oppo R5 สมาร์ทโฟนตัวใหม่ล่าสุดจาก Oppo ที่มีทีเด็ดอยู่ที่ความบางเพียง 4.85 มม. เท่านั้น นอกจากจะบางแล้วสเปคก็ถือว่าจัดเต็มมาให้ด้วยหน้าจอ Amoled ขนาด 5.2 นิ้ว ความละเอียด Full-HD หน่วยประมวลผล Snapdragon 615 Octa-core 1.5 GHz แรม 2 GB กล้องหน้า 5 ล้านพิกเซลเอาใจคอเซลฟี่และกล้องหลัง 13 ล้านพิกเซล !!
sharp,aquos crystal x,,ขาว : ดำ : แดง,16 GB,SHARP Aquos Cystal X สมาร์ทโฟนแอนดรอยด์หน้าจอ 5.5 นิ้ว ความละเอียด Full HD 1080P รันบนระบบปฏิบัติการแอนดรอยด์ 4.4.4 (Kitkat) ขับเคลื่อนด้วย CPU Quad-Core 2.3 GHz  RAM 2 GB  ROM 16 GB รองรับ microSD card สูงสุด 128 GB  ให้ประสบการณ์การถ่ายภาพครบถ้วน ด้วยกล้องหลัง 13 ล้านพิกเซล กล้องหน้า 1.2 ล้านพิกเซล
benq,b502,5690,ขาว : ดำ,4 GB,BenQ B70 สมาร์ทโฟนหน้าจอขนาด 5 นิ้วบนความละเอียด HD IPS หน่วยประมวลผล Quad-core 1.3 GHz พร้อมกับระบบปฏิบัติการ Android 4.4 Kitkat กล้องหลัง 13 ล้านพิกเซล และกล้องหน้า 5 ล้านพิกเซล มาพร้อมกับแรม 1 GB และหน่วยความจำภายใน 4 GB
twz,circle 9,3190,ขาว : ดำ : ชมพู,4 GB,TWZ Circle 9 แฟบเล็ตหน้าจอขนาด 6 นิ้วบนความละเอียด IPS-LCD หน่วยประมวลผล Dual-core 1.2 GHz พร้อมกับระบบปฏิบัติการ Android 4.2 (Jelly Bean) กล้องหลัง 5 ล้านพิกเซล และกล้องหน้า VGA มาพร้อมกับแรม 0.512 GB และหน่วยความจำภายใน 4 GB
twz,circle 8,3290,ขาว : ดำ : ชมพู : น้ำเงิน,4 GB,TWZ Circle 8 แฟบเล็ตหน้าจอขนาด 5 นิ้วบนความละเอียด LCD หน่วยประมวลผล Dual-core 1.2 GHz พร้อมกับระบบปฏิบัติการ Android 4.2 (Jelly Bean) กล้องหลัง 2 ล้านพิกเซล และกล้องหน้า VGA มาพร้อมกับแรม 0.512 GB และหน่วยความจำภายใน 4 GB
twz,circle 5,3590,ขาว : ดำ,4 GB,TWZ Circle 5 สมาร์ทโฟนหน้าจอขนาด 4.5 นิ้วบนความละเอียด IPS-LCD หน่วยประมวลผล Quad-core 1.3 GHz พร้อมกับระบบปฏิบัติการ Android 4.2 (Jelly Bean) กล้องหลัง 5 ล้านพิกเซล และกล้องหน้า VGA มาพร้อมกับแรม 0.512 GB และหน่วยความจำภายใน 4 GB
twz,circle 1,2890,ขาว : ดำ : ชมพู : เขียว,4 GB,TWZ Circle 1 สมาร์ทโฟนหน้าจอขนาด 4.5 นิ้วบนความละเอียด IPS-LCD หน่วยประมวลผล Dual-core 1.2 GHz พร้อมกับระบบปฏิบัติการ Android 4.2 (Jelly Bean) กล้องหลัง 2 ล้านพิกเซล และกล้องหน้า VGA มาพร้อมกับแรม 0.512 GB และหน่วยความจำภายใน 4 GB
sharp,aquos crystal,,ขาว : ดำ : ชมพู : ฟ้า,8 GB,SHARP Aquos Cystal สมาร์ทโฟนแอนดรอยด์หน้าจอ 5 นิ้ว ความละเอียด HD 720P รันบนระบบปฏิบัติการแอนดรอยด์ 4.4.2 (Kitkat) ขับเคลื่อนด้วย CPU Quad-Core 1.2 GHz  RAM 1.5 GB  ROM 8 GB 
moto,nexus 6,,midnight blue : cloud white,32 GB,Motorola Nexus 6 สมาร์ทโฟนแอนดรอยด์หน้าจอ 5.96 นิ้ว ความละเอียด Quad HD รันบนระบบปฏิบัติการแอนดรอยด์ 5.0 (Lollipop) ขับเคลื่อนด้วย CPU Quad-Core 2.7 GHz  RAM 3 GB  ROM 32 GB 
doogee,dg800,4990,white : deep blue : orange : light blue : light purple : deep pink,8 GB,Doogee DG800 สมาร์ทโฟนหน้าจอขนาด 4.5 นิ้วบนความละเอียด IPS หน่วยประมวลผล Quad-core 1.3 GHz พร้อมกับระบบปฏิบัติการ Android 4.4.2 (Kitkat) กล้องหลัง 13 ล้านพิกเซล และกล้องหน้า 8 มาพร้อมกับแรม 1 GB และหน่วยความจำภายใน 8 GB
microsoft,lumia 535,4490,orange : green : white : black : gray : blue,8 GB,Microsoft Lumia 535 สมาร์ทโฟนหน้าจอขนาด 5 นิ้วบนความละเอียด IPS หน่วยประมวลผล Quad-core 1.2 GHz พร้อมกับระบบปฏิบัติการ Windows 8.1 กล้องหลัง 5 ล้านพิกเซล และกล้องหน้า 5 มาพร้อมกับแรม 1 GB และหน่วยความจำภายใน 8 GB
huawei,ascend mate 7 (gold),17990,obsidian black: moonlight silver: amber gold,32 GB,Huawei Ascend Mate 7 เปิดตัวรุ่นพรีเมี่ยม ความจุ 32 GB แรม 3 GB รองรับการใช้งาน 2 ซิม มาพร้อมระบบปฎิบัติการ Android 4.4 Kitkat กล้องหลัง 13 ล้าน กล้องหน้า 5 ล้าน
lenovo,a536,3590,ขาว : ดำ,8 GB,สมาร์ทโฟนดีไซน์สวยอย่าง Lenove A536 ราคาสบายๆ ไม่ถึง 4 พัน มาพร้อมกับระบบปฎิบัติการแอนดรอยด์ 4.4.2 (KitKat) หน้าจอขนาด 5 นิ้ว หน่วยประมวลผล Quad Core 1.3 GHz หน่วยความจำตัวเครื่อง 8 GB แรม 1 GB กล้องหลังความละเอียด 5 ล้านพิกเซล กล้องหน้าความละเอียด 2 ล้านพิกเซล
asus,zenfone 5 lite (a502cg),,charcoal black: pearl white: cherry red,8 GB,Zenfone 5 Lite ลดสเปคจาก Zenfone 5 มาพร้อมกับจอแสดงผลแบบ IPS ขนาดใหญ่ถึง 5 นิ้ว ระบบประมวลผล Dual-core 1.2 GHz หน่วยความจำภายใน 8 GB แรม 1 GB รองรับ microSD กล้องหลังความละเอียด 8 ล้านพิกเซล กล้องหน้าความละเอียด 0.3 ล้านพิกเซล
