lg,v10,,สีดำ:สีขาว:สีน้ำเงิน:สีเงิน:สีทอง,64 GB,LG V10 เป็นสมาร์ตโฟนสองหน้าจอ หน้าจอหลักมากับขนาด 5.7 นิ้วความละเอียด 1440x2560px และแท็บด้านบนหรือหน้าจอที่สองมีขนาด 2.1นิ้ว ชิปเซ็ตประมวลผล หน้าจอที่สอง : 2.1 นิ้ว CPU Quad-core GPU Adreno 418 RAM 4GB ROM 64GB กล้องหลังความละเอียด 16MP  5312 x 2988 pixels และกล้องหน้า 5MP DuoCam ระบบปฏิบัติการ Android 5.1 แบตเตอรี่ 3000 mAh
ais,super combo lava iris 600,2390,สีดำ,8 GB,สมาร์ตโฟนราคาเบาๆ จากค่าย AIS "Super Combo LAVA iris 600" ที่ให้เพื่อนที่ต้องการความคุ้มค่ากับราคาเพียง 2 390 บาท พร้อมแพ็คเกจ ค่าโทรฟรีและอินเทอร์เน็ตสูงสุดเท่ากับราคาเครื่องเลยทีเดียว !! และสเปคคราวๆก็จะมี CPU Dual-Core 1.3GHz   RAM 1GB  ROM 8GB  กล้องหน้า 5MP+LED Flash กล้องหลัง 2MP+Flash รันระบบปฏิบัติการ Android 5.1 แบตเตอรี่ 1 750 mAh
samsung,galaxy on7,,สีขาว:สีทอง,8 GB,Samsung ประกาศเปิดตัวสมาร์ตโฟนน้องใหม่อีกรุ่นในชื่อว่า Samsung Galaxy On7 มากับหน้าจอความละเอียด HD 720p ขนาด 5 นิ้ว CPU Quad Core ความเร็ว 1.2GHz RAM 1.5GB ROM 8GB ระบบปฏิบัติการ Android 5.1 Lollipop กล้องหลัง 13MP กล้องหน้า 5MP แบตเตอรี่ 3000 mAh
asus,laser (ze500kl),5990,black: white: red: silver: gold,16 GB,Asus Zenfone 2 Laser ZE500KL มากับหน้าจอ 5 นิ้ว HD 1280*720px รันระบบปฏิบัติการ Android 5.0 (Lollipop) CPU Snapdragon™ 410 4-core และ GPU Adreno 306 RAM ให้มา 2 GB และความจำภายใน 16GB ส่วนกล้องหลังความละเอียด 13 ล้านพิกเซล พร้อมแฟลช และกล้องหน้าความละเอียด 5 ล้านพิกเซล แบตเตอรี่ Li-Po 2400 mAh
zte,blade s7,8900,สีเขียวมะนาว:สีทอง:สีขาว:สีเทา,32 GB,ZTE Blade S7 มาพร้อมกับเวอร์ชั่นฉบับปรับปรุงของ Intuitive Gesture Control การเคลื่อนไหวร่างกาย หรือแสดงท่าทางเพื่อเข้าสู่เมนูต่างๆ ในเครื่อง แม้ขณะหน้าจอล็อค ซึ่งคุณสมบัตินี้พัฒนามาจาก Smart Sense ในรุ่น Blade S6 โดย Intuitive Gesture Control  สามารถตอบสนองการใช้งานของผู้ใช้ ให้ได้รับความสะดวกรวดเร็วมากขึ้น
htc,one e9 plus,16990,meteor gray: classic rose gold: gold sepia,32 GB,HTC ONE E9 Plus ก็จะมา่ขุมพลังการประมวลผล Mediatek MT6795M Helio X10 (Octa-Core) ชิปแสดงผล PowerVR G6200 หน่วยความจำหลัก 3GB และหน่วยความจำภายใน 32GB โดยจะมีกล้องหน้าความละเอียด 13 ล้านพิกเซลและกล้องหลังความละเอียด 20 ล้านพิกเซล รองรับ NFC ระบบปฏิบัติการ Android 5.0 และคาดว่าจะสามารถอัพเป็น 6.0 ได้อีกด้วยย
zte,blade a711,5990,สีเงิน,16 GB,ZTE Blade A711 มาพร้อมกับสเปคได้มาตรฐานและเทคโนโลยีปลดล็อคด้วยลายนิ้วมือ มาพร้อมกับ ซีพียู Octa Core แรม 2GB หน่วยความจำภายใน 16GB แสดงผลหน้าจอขนาด 5.5 นิ้ว ความละเอียด Full-HD (1920*1080 px) ระบบปฏิบัติการ Android 5.1 กล้องหลังความละเอียด 13 ล้านพิกเซล และกล้องหน้าความละเอียด 5 ล้านพิกเซล
wiko,fever,6990,สีขาว:สีดำ,16 GB,Wiko Fever 4G สมาร์ทโฟนที่มาพร้อมวัสดุเรืองแสงในเวลากลางคืน!! ในส่วนของหน้าตาสมาร์ทโฟนตัวนี้ จากที่ได้สัมผัสนั้นหน้าตาดีพอสมควร ตัวเครื่องและหน้าจอโค้งมนเล็กน้อย และในส่วนฝาหลังทำเป็นลายหนัง ในส่วนขอบของตัวเครื่องจะตัดขอบด้วยวัสดุเรืองแสง ในส่วนขนาดหน้าจอ 5.2 นิ้ว Corning Gorilla Glass3 ให้ความละเอียดระดับ Full-HD (1920x1080 พิกเซล) และสัดส่วนตัวเครื่อง 73.8x148x8.3 มิลลิเมตร มีน้ำหนัก 143 กรัม ความเห็นส่วนตัวรู้สึกว่าเล็กและเบาแต่ให้ความรู้สึกแข็งแรงไม่น้อย
wiko,pulp,3990,black:white:chocolate:electric blue:flashy red,16 GB,Wiko Pulp สมาร์ทโฟนราคาประหยัด ที่มากับหน้าจอใหญ่ยักษ์ขนาด 5 นิ้วความละเอียดระดับ HD (1280*720) ชิปประมวลผล Octa-Core 1.4Ghz RAM 2GB หน่วยความจำภายใน 16GB สามารถเพิ่มหน่วยความจำด้วย Micro-SD Card อีก 64GB กล้องหน้าความละเอียด 5ล้านพิกเซล และกล้องหลังความละเอียด 13ล้านพิกเซล ตัวเครื่องมีสีให้เลือกใช้งานถึง 5 สี
obi,worldphone sf1,7290,สีดำ,16 GB,Obi Worldphone SF1 ตัวเครื่องเป็นโลหะขึ้นรูปแบบยูนิบอดี้ จอแสดงผลแบบ JDI In-Cell IPS Full HD 1080p ขนาด 5 นิ้ว ความละเอียด 1080x1920 พิกเซล พร้อมกระจกป้องกันหน้าจอ Gorilla Glass 4 หน่วยประมวลผลชิปเซ็ต 64-bit Octa-Core Qualcomm Snapdragon 615 ความเร็วในการประมวลผล 1.5 GHz หน่วยความจำแรม 2GB หน่วยความจำภายใน 16GB รองรับหน่วยความจำเสริมแบบ microSD สูงสุด 64GB
htc,one m9s,,gold: silver: pink: gunmetal,16 GB,HTC One M9S สมาร์ทโฟน Lite ของรุ่น HTC One M9 ตัวล่าสุดจากทาง HTC จอกว้าง 5 นิ้ว แสดงผลแบบ Full HD ให้สีสันคมชัดแบบสุดๆ HTC One M9S มาพร้อมระบบปฏิบัติการแอนดรอยด์ 5.1 Lollipop หน่วยประมวลผล Octa-core 2.2 GHz Cortex-A53 ลงแอพฯที่มีกราฟฟิคสูงๆได้ไม่มีปัญหา พร้อมลำโพงคู่หน้าประสิทธิภาพอย่าง Boomsound กล้องหน้า 4 ล้านพิกเซล UltraPixel พร้อมกล้องหลัง 13 ล้านพิกเซลพร้อมแฟลชคู่
acer,liquid z630s,8990,สีขาว:สีดำ,32 GB,Acer Liquid Z630S อีกขั้นหนึ่งของ Acer Z630 รันระบบปฏิบัติการณ์ Android 5.1 ที่มาพร้อมกับหน่วยประมวลผล MediaTek MT6753 Octa Core 1.3Ghz แรม 3GB หน่วยความจำภายใน 32GB ในส่วนกล้องหลังความละเอียด 8 ล้านพิกเซลพร้อม LED Flash และกล้องหน้าความละเอียด 8 ล้านพิกเซลเช่นกัน และมีความจุแบตเตอรี่สูงถึง 4000mAh
acer,liquid z530s,7990,สีดำ:สีขาว,32 GB,Liquid Z530S มือถือราคากลางๆที่น่าสนใจไม่น้อย ด้วยเทคโนโลยี Zero Air Gap ที่ช่วยลดแสงสะท้อนของหน้าจอ หน่วยประมวลผลเป็น Mediatek MT6753 Octa-core  1.3 GHz แรม 3GB หน่วยความจำภายในเป็น 32GB รองรับ Micro SD Card สุงสุด 32GB ซึ่งน่าจะเพิ่มได้มากกว่านี้ ตัวกล้องมีหลายฟังก์ชั่นด้วยกันแต่ที่เด่นคือการสั่งงานด้วยเสียงนั่นเองโดยมีความละเอียดเท่ากันทั้งกล้องหน้าและหลังคือ 8 ล้านพิกเซล
acer,liquid z330,4590,สีขาว:สีดำ,8 GB,Acer Liquid Z330 สมาร์ทโฟนราคาย่อมเยามาพร้อมกับสเปคที่ได้มาตรฐาน รันระบบปฏิบัติการ Android 5.1 ชิปประมวลผล Qualcomm MSM8909 Snapdragon 210 หน่วยประมวลผล Quad Core 1.1GHz RAM 1GB ROM 8GB กล้องหน้าและกล้องหลังมีความละเอียด 5 ล้านพิกเซลเท่ากัน ความจุแบตเตอรี่ 2000 mAh
ais,super combo lava a2,7290,สีดำ,16 GB,AIS SUPER COMBO LAVA A2 หน้าจอคมชัดใหญ่ขึ้นกว่าเดิมด้วยหน้าจอกว้างขนาด 5.2 นิ้ว พร้อมคุณภาพระดับ Full HD ทำให้ได้ภาพคมชัดยิ่งขึ้นละเอียดยิ่งกว่า และแรงยิ่งขึ้นประมวลผลเร็วยิ่งกว่าด้วยซีพียูใหม่ล่าสุด Octa Core 1.3 GHz ทำให้ตอบสนองการทำงานได้เร็วมากขึ้นกว่าเดิม อีกทั้งเนื้อที่ในการประมวลผล RAM 3GB จึงทำให้สมาร์ทโฟนเครื่องนี้ทำงานได้รวดเร็วตามใจต้องการ
true,smart 4g plus,4290,สีดำ:สีขาว,8 GB,True Smart 4G Plus สมาร์ทโฟนน้องใหม่ราคาประหยัดจากค่ายเครือข่ายมือถือยักษ์ใหญ่อย่าง True ในส่วนสเปคที่จัดมาได้อย่างมาตรฐานด้วยชิปเซ็ตประมวลผล Quad-Core Snapdragon 410  ทำให้การใช้งานต่างๆไหลลื่น และหน้าจอที่มีขนาด 5 นิ้วและความคมชัดระดับ HD จึงทำให้ได้รับอรรถรสอย่างเต็มเปลี่ยมไม่ว่าจะดูหนัง ฟังเพลง หรือเล่นเกม..
true,smart 4g hd voice,6290,สีขาว:สีดำ,16 GB,True Smart 4G HD Voice ภาพสวยทุกมุมมอง... กับโหมดกล้องอัฉริยะ กับกล้องหลังความละเอียด 13 ล้านพิกเซล F2.0 ด้วยโหมดกล้องอัจฉริยะ มาคู่กับกล้องหน้าความละเอียด 5 ล้านพิกเซลพร้อมโหมดเซลฟี่ หน้าจอขนาด 5 นิ้ว คมชัดระดับ HD รองรับการใช้งาน VolTE
vivo,x6,,สีทอง: สีเงิน: สีทองกุหลาบ,32 GB,Vivo X6 ที่มากับบอดี้โลหะ หน้าจอ Super AMOLED ขนาด 5.2 นิ้ว ความละเอียด Full HD 1080p ชิปเซ็ตประมวล MediaTek MT6752 Octa Core CPU ความเร็ว 1.7GHz RAM 4GB หน่วยความจำเครื่อง 32GB รันระบบปฏิบัติการ Android 5.1 Lollipop ครอบด้วย Funtouch OS รองรับ 4G LTE ระบบสแกนลายนิ้วมือด้านหลังตัวเครื่อง ปลดล็อคหน้าจอ้เวลาเพียง 0.4 วินาที กล้องหน้า 8ล้านพิกเซล กล้องหลัง 13ล้านพิกเซล แบตเตอรี่ความจุ 2 400mAh รองรับระบบชาร์จไว Fast Charge
vivo,x6 plus,,สีทอง: สีเงิน: สีทองกุหลาบ,64 GB,Vivo X6 Plus ที่มากับบอดี้โลหะ หน้าจอ Super AMOLED ขนาด 5.7 นิ้ว ความละเอียด Full HD 1080p ชิปเซ็ตประมวล MediaTek MT6752 Octa Core CPU ความเร็ว 1.7GHz RAM 4GB หน่วยความจำเครื่อง 64GB รันระบบปฏิบัติการ Android 5.1 Lollipop ครอบด้วย Funtouch OS รองรับ 4G LTE ระบบสแกนลายนิ้วมือด้านหลังตัวเครื่อง ปลดล็อคหน้าจอ้เวลาเพียง 0.4 วินาที กล้องหน้า 8ล้านพิกเซล กล้องหลัง 13ล้านพิกเซล แบตเตอรี่ความจุ 3000mAh รองรับระบบชาร์จไว Fast Charge
meizu,mx5,,สีดำ:สีขาว:สีเทา:สีชมพู,32 GB,Meizu MX5 สมาร์ตโฟนเรือธงกล้องหลังเลเซอร์ออโต้โฟกัสที่มีความละเอียด 20.7 ล้านพิกเซล เลนส์ 6 ชิ้น ขนาดรูรับแสง F2.2 พร้อมระบบ Laser autofocus ถ่ายสโลว์โมชั่นความละเอียด HD 720p ได้ที่ 100fps รองรับวิดีโอ 4K ตัวเครื่องผลิตจากโลหะ บางเพียง 7.6 มม. หน้าจอ AMOLED ขนาด 5.5 นิ้วความละเอียด Full HD 1080p ชิปเซ็ต MediaTek Helio X10 64-bit Octa Core CPU ความเร็ว 2.2GHz RAM 3GB รันระบบปฏิบัติการ Android 5.0 Lollipop ครอบด้วย Flyme 4.5 เวอร์ชั่น 64-bit
htc,one x9,,สีขาว:สีดำ,64 GB,HTC One X9 นั้นมาพร้อมกับหน้าจอ 2K Quad HD (1440 x 2560 พิกเซล) ขนาด 5 นิ้ว  ชิปเซ็ต Snapdragon 820 หรือ MediaTek Helio X20 (ตัวที่เป็น 10 Core CPU  4GB RAM  กล้องหน้า 4 ล้านพิกเซลแบบ UltraPixel  กล้องหลัง 23 ล้านพิกเซล  ความจุ 64GB หรือ 128GB  แบตเตอรี่ 3 500 mAh และลำโพงคู่ BoomSound
asus,zenfone go (zc500tg),4290,สีแดง:สีขาว:สีดำ,16 GB,ZenFone Go มีขนาดหน้าจอ 5 นิ้ว หน้าจอแสดงผล IPS HD ชิปประมวลผล MediaTek MT6580 Quad-Core 1.3GHz RAM 2GB หน่วยความจำเครื่อง 16GB สามารถเพิ่มได้สูงสุด 64GB โดย MicroSD-Card กล้องหน้าความละเอียด 2 ล้านพิกเซล กล้องหลังความละเอียด 8 ล้านพิกเซล ความจุแบตเตอรี่ 2070 mAh
letv,le 1s,,สีชมพู สีทอง สีขาว,32 GB,LeMobile Le 1s ด้วยหน้าจอกว้าง 5.5 นิ้ว FHD In-Cell  403 PPI ประมวลผลด้วยชิปเซ็ต Media Tek Helio X10 Turbo 2.2GHz  Octa-Core แบบ 64 บิต ความเร็ว 2.2GHz  Ram 3GB  หน่วยความจำภายใน 16/32/64GB และแบตเตอรี่ 3 000 m ส่วนกล้องดิจิตอลด้านหลังมีความละเอียด 13 ล้านพิกเซล+ระบบป้องกันภาพสั่นไหว (OIS) และไฟแฟลชคู่ LED ส่วนด้านหน้าเป็นกล้องเซลฟี่ 5 ล้านพิกเซล
letv,le max,,สีชมพู สีทอง สีขาว,64 GB,Le Max จัดเต็มกับสเปคสุดๆกับหน้าจอขนาดยักษ์ 6.3 นิ้ว ความละเอียด QuadHD ขับเคลื่อนด้วย CPU Snapdragon 810 และ RAM 4GB LPDDR4 กล้อง 21 ล้าน f2.0 พร้อมระบบกันสั่น OIS (ใช้ Sensor ของ Sony IMX230) แบตเตอรี่ใหญ่ขึ้นอีกเป็น 3 500 mAh นอกจากนั้น Le Max ยังมีเทคโนโลยีอื่นอย่าง ระบบสแกนลายนิ้วมือ  ชิพเสียง ESS Hi-Fi  ระบบส่งสัญญาณหน้าจอ WirelessHD  รองรับ 2 SIM LTE 4G  และ ตัวส่งคลื่นอินฟราเรดสำหรับใช้เป็นรีโมตทีวีได้อีกด้วย ซึ่งทุกรุ่นมีช่อง USB-C แทนพอร์ต microUSB อีกด้วย
vivo,y51,6990,สีขาว:สีดำ,16 GB,vivo Y51 ใช้ระบบ Android 5.0 Lollipop ทำงานเต็มประสิทธิภาพบนระบบปฏิบัติการ Funtouch OS 2.5 (Based on Android 5.0 Lollipop) พร้อมความจุแบตเตอรี่ที่ใช้งานได้นานยิ่งขึ้นสะดวกทุกการติดต่อพร้อมรองรับการใช้งานในระบบเครือข่าย 4G ได้ทั้ง 2 ซิมโดยการใส่ไมโครซิมในช่องซิมหลักและเลือกใส่ TF card หรือนาโนซิมในช่องซิมรองได้ตามการใช้งานของคุณมาพร้อม 4G ในระบบ LTE ที่ให้คุณใช้งานโซเชียลมีเดียบนความเร็วอินเทอร์เน็ตที่แรงขึ้นกว่าเดิม
aston,infinite 2,2990,สีทอง,8 GB,Aston Infinite II สมาร์ทโฟนจอใหญ่ 5.5 นิ้วแต่ราคาถูก แต่สเปคไม่เบา มาพร้อมฟังก์ชั่นสุดเจ๋งตอบสนองทุกความต้องการ ไม่ว่าจะท่องโลกออนไลน์ แชทกับเพื่อนๆดูหนัง ฟังเพลง รองรับการใช้งาน 2 SIM มาพร้อมกับ CPU Cortex-A7 4 Core 1.30Ghz RAM 1GB หน่วยความจะภายใน 8GB  สามารถเพิ่มหน่วยความจำได้สูงสุด 32GB โดย MicroSD-Card
aston,thunder max,3790,สีน้ำเงินเข้ม:สีขาว,8 GB,Aston Thunder Max สมาร์ทโฟนจอใหญ่ 6 นิ้ว นิยามใหม่ของความคุ้มค่า แต่ราคาสบายกระเป๋า มาพร้อมฟังก์ชั่นสุดเจ๋ง ตอบสนองทุกความต้องการ ไม่ว่าจะท่องโลกออนไลน์ เล่นเกม แชทกับเพื่อนๆ ดูหนัง ฟังเพลงได้ทุกที่ รวดเร็วทันใจด้วยหน่วยประมวลผล Quad-Core Mediatek MT6582 1.3 GHz ชัดเต็มตาด้วยหน้าจอขนาด 6 นิ้ว พร้อมกล้องหลัง 13 ล้านพิกเซลและกล้องหน้า 8 ล้านพิกเซล ที่ทำให้คุณถ่ายภาพได้สวยคมชัด ถูกใจคุณอย่างแน่นอน รองรับการใช้งาน 2 SIM และยังสามารถเพิ่มความจำภายนอก (Micro SD card) สูงสุด 32 GB ได้อีกด้วย
aston,pro 4g,4190,สีทอง,8 GB,Aston Pro 4G สมาร์ทโฟนระดับคุณภาพที่จะมาช่วยตอบสนองทุกความต้องการอย่างลงตัวด้วยระบบปฏิบัติการ Android 5.1 Lollipop เเละรวดเร็วทันใจด้วยหน่วยประมวลผลที่ดีเยี่ยม พร้อมหน้าจอขนาด 5.5 นิ้ว และกล้องหลังที่มีความละเอียดมากถึง 13 ล้านพิกเซล ทำให้คุณสามารถถ่ายภาพได้สวยคมชัดถูกใจคุณอย่างแน่นอน และสเปคที่ได้มาตราฐานที่มาพร้อมกับ CPU MT6735P 4Core RAM 1GB และหน่วยความจำภายใน 8GB สามารถเพิ่มด้วยความจำด้วย MicroSD-Card ได้สูงสุด 64GB 
zte,blade v6,4990,เทา:เงิน:ทอง:ชมพู,16 GB,ZTE Blade V6 4G เป็นรุ่นใหม่ล่าสุดของซีรี่ส์ Blade ภายใต้คอนเซ็ปต์ ‘premium affordable’ สมาร์ทโฟนพรีเมียมในราคาที่ซื้อได้ พร้อมด้วยสเปคเครื่องที่จัดเต็ม หน้าจอ 5 นิ้ว HD หน่วยประมวลผล 1.3Ghz quad-core หน่วยความจำภายใน 2GB RAM 16 GB ROM ระบบปฏิบัติการ Android 5.0.2 Lollipop ส่วนไฮไลท์ของเครื่องคือดีไซน์ และออกแบบโดยใช้โลหะเกรดดี น้ำหนักเบาและบางเพียง 6.8 มม.ที่สำคัญถือว่าเป็นโทรศัพท์ 4G พรีเมียมดีไซน์เครื่องแรกในตลาดที่ขายราคาไม่กี่พันบาท
