i-mobile,iqx2,7990,ขาว:ดำ,4 GB,i-mobile IQ X2 รองรับ 2 ซิมการ์ด จอแสดงผล TFT-LCD 16 ล้านสี ระบบสัมผัส Multi-Touch กว้าง 5 นิ้ว ความละเอียด 1920 x 1080 พิกเซล ระบบปฏิบัติการ: Android 4.2 (Jelly Bean)หน่วยประมวลผล : MTK 6589T Quad Core ความเร็ว 1.5 GHz กล้องดิจิตอล 18 ล้านพิกเซล พร้อมแฟลช LED กล้องหน้า ความละเอียด 8 ล้านพิกเซล รองรับ Video Call สนทนาแบบเห็นภาพ
i-mobile,iq 5.3,5790,ขาว:ดำ:เทา,4 GB,i-mobile IQ 5.3 รองรับ 2 ซิมการ์ด กว้าง 5 นิ้ว ความละเอียด 480 x 854 พิกเซล ระบบปฏิบัติการ: Android 4.2 (Jelly Bean) หน่วยประมวลผล Quad Core ความเร็ว 1.2 GHz กล้องดิจิตอล 12 ล้านพิกเซล กล้องหน้า ความละเอียด 5 ล้านพิกเซล
i-mobile,iq 9a,9490,ขาว:ดำ,4 GB,i-mobile IQ 9A รองรับการใช้งาน 2 ซิมการ์ดพร้อมกันภายในเครื่องเดียว ประมวลผลการทำงานด้วย Quad-Core Cortex-A7 Processor (ชิปเซ็ต MediaTek MTK6589) ความเร็วในการประมวลผล 1.2 GHz พร้อมระบบปฏิบัติการ Android OS เวอร์ชัน 4.2.1 (Jelly Bean) กล้องดิจิตอลด้านหลังของตัวเครื่อง ความละเอียดระดับ 13 ล้านพิกเซล ด้านหน้าของตัวเครื่อง ความละเอียดระดับ 8 ล้านพิกเซล
i-mobile,iq 9,9490,ขาว:ดำ,4 GB,i-mobile IQ 9A รองรับการใช้งาน 2 ซิมการ์ดพร้อมกันภายในเครื่องเดียว ประมวลผลการทำงานด้วย Quad-Core Cortex-A7 Processor (ชิปเซ็ต MediaTek MTK6589) ความเร็วในการประมวลผล 1.2 GHz พร้อมระบบปฏิบัติการ Android OS เวอร์ชัน 4.2.1 (Jelly Bean) กล้องดิจิตอลด้านหลังของตัวเครื่อง ความละเอียดระดับ 13 ล้านพิกเซล ด้านหน้าของตัวเครื่อง ความละเอียดระดับ 8 ล้านพิกเซล
i-mobile,i-style 7.1,3990,ขาว:ดำ,4 GB,i-mobile i-STYLE 7.1 รองรับ 2 ซิมการ์ด ขนาด: 127 × 65.5 × 11.9 มิลลิเมตร น้ำหนัก 132 กรัม ระบบปฏิบัติการ Android 4.1 (Jelly Bean) หน่วยประมวลผล Dual Core ความเร็ว : 1 GHz กล้องดิจิตอล 5 ล้านพิกเซล พร้อมแฟลช ซูมดิจิตอล (Digital Zoom) ปรับภาพอัตโนมัติ (Auto Focus) ค้นหาใบหน้าอัตโนมัติ (Face Detection) กล้องหน้า ความละเอียด 0.3 ล้านพิกเซล
i-mobile,iqxa,8790,ขาว:ดำ,4 GB,i-mobile IQ XA ประมวลผลการทำงานด้วย Quad-Core Cortex-A7 Processor (ชิปเซ็ต MediaTek MTK6589) ความเร็วในการประมวลผล 1.2 GHz พร้อมระบบปฏิบัติการ Android OS เวอร์ชัน 4.2.1 (Jelly Bean) กล้องด้านหลังของตัวเครื่อง ความละเอียดระดับ 18 ล้านพิกเซล(อาศัยซอฟต์แวร์ขยายความละเอียดของภาพจากความละเอียดจริงที่ 12.7 ล้านพิกเซล เทคนิคแบบ Interpolation) พร้อมกล้องด้านหน้า ความละเอียดระดับ 8 ล้าน Pixels
i-mobile,iqx,8790,ขาว:ดำ,4 GB,i-mobile IQ X สมาร์ทโฟนสเปคเยี่ยมกกับราคาเบาๆ จาก i-mobile ตอบสนองทุกความต้องการอย่างลงตัวด้วย ระบบปฏิบัติการ Android เวอร์ชั่น 4.2 รวดเร็วทันใจด้วยหน่วยประมวลผล Quad-core 1.2GHZ พร้อมหน้าจอ HD ขนาด 4.7 นิ้วและกล้องหลังความละเอียดมากถึง 18 ล้านพิกเซล ถ่ายภาพได้สวยคมชัดถูกใจคุณอย่างแน่นอน
i-mobile,iq 1.1,5300,ขาว:ดำ,4 GB,i-mobile IQ 1.1 รองรับ 2 ซิมการ์ด กว้าง 4.5 นิ้ว ความละเอียด 540 x 960 พิกเซล ระบบปฏิบัติการ: Android 4.1 (Jelly Bean) หน่วยประมวลผล : MSM8225Q Quad Core ความเร็ว 1.2 GHz กล้องดิจิตอล 8 ล้านพิกเซล พร้อมแฟลช ปรับภาพอัตโนมัติ (Auto Focus) กล้องหน้า  ความละเอียด 5 ล้านพิกเซล
lenovo,p780,9990,ดำ,4 GB,ตอบสนองยุคแห่งการติดต่อสื่อสาร ด้วย Lenovo P780 แอนดรอยด์โฟนราคาเบาๆ แต่เปี่ยมไปด้วยประสิทธิภาพ มาพร้อมหน้าจอขนาดใหญ่ถึง 5 นิ้ว รองรับการใช้งาน 2 ซิม โดยมีซีพียู Quad Core 1.2 GHz ระบบปฏิบัติการ Android 4.2 Jelly Bean ที่ตอบโจทย์การใช้งานมัลติมีเดียได้อย่างลงตัว มีพื้นที่หน่วยความจำภายใน 4GB
lenovo,s920 [4gb],6490,ขาว:ดำ,4 GB,สมาร์ทโฟนดีๆมาฝากกันอีกเช่นเคย แน่นอนมาวันนี้ไม่มามือเปล่าแต่มาพร้อมกับเจ้า Lenovo S920 สมาร์ทโฟนจากค่ายยักษ์ใหญ่คอมพิวเตอร์ หลายคนอาจสงสัยว่า เอ๊ะ!! Lenovo มาผลิตสมาร์ทโฟนแล้วมันจะดีเหมือนคอมพิวเตอร์รึป่าว ก่อนอื่นเลยมาทำความรู้จัก Lenovo S920 กันก่อน มาพร้อมกับระบบปฏิบัติการ Android 4.2 (Jelly Bean) หน่วยประมวลผล MTK 6589 Quad Core ความเร็ว : 1.2 GHz พร้อม RAM 1GB หน่วยความจำความจำ 4GB สเปคที่ให้ก็ถือว่าแรงพอตัวครับ
lenovo,s820 [4gb],7990,ขาว:ดำ:แดง,4 GB,สำหรับวันนี้ก็มีสมาร์ทโฟนมาฝากกันอีกเช่นเคย เป็นสมาร์ทโฟนจากค่าย Lenovo นั้นคือเจ้า Lenovo S820 ถ้าจะพูดไปแล้วมันก็คือศิษย์น้องร่วมสำนักกับเจ้า S920 ที่ได้เปิดตัวกันไปก่อนหน้านี้แล้วนั้นเอง แน่นอนการมาครั้งนี้ของ Lenovo S820 จะมีอะไรเปลี่ยนแปลงไปจากศิษย์พี่ของมันบ้าง คงต้องไปดูกันซะหน่อยแล้วละครับ
lenovo,a706,5990,ขาว,4 GB,ตอบสนองยุคแห่งการติดต่อสื่อสาร ด้วย Lenovo A706 แอนดรอยด์โฟนราคาเบาๆ แต่เปี่ยมไปด้วยประสิทธิภาพ มาพร้อมหน้าจอขนาดใหญ่ถึง 4.5 นิ้ว สามารถรองรับการใช้งานได้ถึง 2 ซิม โดยมีซีพียู Qualcomm Snapdragon MSM8225Q Quad Core 1.2 GHz ระบบปฏิบัติการ Android 4.1 (Jelly Bean) ที่ตอบโจทย์การใช้งานมัลติมีเดียได้อย่างเต็มที่ มีพื้นที่หน่วยความจำภายใน 4GB พร้อมกล้องดิจิตอลความละเอียด 5 ล้านพิกเซล
lenovo,a390,2990,ดำ,4 GB,ตอบสนองยุคแห่งการติดต่อสื่อสาร ด้วย Lenovo A390 แอนดรอยด์โฟนราคาเบาๆ แต่เปี่ยมไปด้วยประสิทธิภาพ มาพร้อมหน้าจอขนาดใหญ่ถึง 4 นิ้ว สามารถรองรับการใช้งานได้ถึง 2 ซิม โดยมีซีพียู Dual-core 1GHz ระบบปฏิบัติการ Android V.4.0.4 (Ice Cream Sandwich) ที่ตอบโจทย์การใช้งานมัลติมีเดียได้อย่างเต็มที่ มีพื้นที่หน่วยความจำภายใน 4GB พร้อมกล้องดิจิตอลความละเอียด 5 ล้านพิกเซล
lenovo,k900 [[16gb]],13490,เทา,16 GB,Lenovo K900 16GB สมาร์ทโฟนแอนดรอยด์ พลัง intel inside ที่ใช้ intel atom 2.0 GHz dual-core เป็นตัวขับเคลื่อน นอกจากจุดเด่นเรื่องของ CPU แล้ว ยังมีหน้าจอขนาด 5.5 นิ้ว Full HD RAM 2 GB พร้อมกล้อง 13 ล้านพิกเซล ที่มีค่า f1.8 และกล้องหน้าเลนส์ไวด์ 88 องศา พร้อมให้คุณถ่ายภาพได้กว้าง และชัดเจนมากยิ่งขึ้น รองรับระบบ 3G ทุกเครือข่าย
lg,g2,17900,ขาว:ดำ,32 GB,LG จะเริ่มเรียนรู้วิธีในการต่อสู้กับสมาร์ตโฟนคู่แข่งจากฝั่ง Android ค่ายต่างๆที่อัดฟีเจอร์และคุณสมบัติน่าทึ่งหลายๆอย่างเข้ามาในมือถือเครื่องเดียวด้วยการไม่เลือกเดินตามทางเหล่านี้แล้วหันไปพัฒนา LG G2 ให้กลายเป็นสมาร์ตโฟนที่เรียนรู้จากตัวของผู้ใช้งานเอง แน่นอนว่าคุณสมบัติหลายๆอย่างภายในเครื่องของ LG G2 ได้รับการออกแบบมาให้เติมเต็มอรรถรสในการใช้้งานสมาร์ตโฟนของคุณเองอย่างเต็มที่ชนิดที่บางอย่างเราก็ไม่รู้มาก่อนว่าเราต้องการแต่ LG ก็ใส่มาให้ด้วย เรียกได้ว่างานนี้ LG ขอเปลี่ยนคอนเซปต์ของตัวเองแบบพลิกหน้ามือเป็นหลังมือให้สมกับที่ LG G2
lg,optimus l7 ii,7990,ดำ,4 GB,LG Optimus L7 II โดดเด่นเหนือกว่า เพื่อชีวิตเหนือระดับ แอนดรอยด์ 4.1 JELLY BEAN CPU 1GHZ DUAL CORE หน้าจอขนาด 4.3 นิ้ว พร้อมหน่วยความจำภายใน 4 GB ดี ไซน์ L-SERIES II เรียบหรู มีสไตล ไฟ LED แสดงสถานะบนปุ่มโฮม Q SLIDE สนุกได้ ไม่สะดุด แค่สไลด์ก็สลับฟังก์ชั่นการใช้งานได้ทันที แรงเต็มที่กับ DUAL CORE 1 GHZ
lg,optimus g pro,15900,ขาว:ดำ,16 GB,วันนี้เรามีสมาร์ทโฟน สเปคแรงๆ ราคาคุ้มค่า มาแนะนำให้ทุกคนได้รู้จักกัน นั่นก็คือ LG รุ่น Optimus G pro ที่เป็นรุ่นเรือธงของค่าย LG ในขณะนี้ ที่มากับหน้าจอที่คมชัด รวมถึงสเปคที่แรง เรียกได้ว่าทาง LG นี่จัดเต็มเพื่อมาประชันกับสมาร์ทโฟนแบรนด์ยักษ์ใหญ่หลายๆค่ายในตอนนี้เลยทีเดียว มาพร้อมกับ CPU Quad-Core Processor 1.7GHz และ Chipset Qualcomm Snapdragon 600 หน่วยประมวลผลกราฟฟิค Adreno 320 Ram 2 GB ความจำตัวเครื่อง 16 GB สามารถใส่ MicroSD Card เพิ่มได้ มากับระบบปฏิบัติการ Android 4.1.2 Jelly Bean
lg,optimus l5 ii,5990,ดำ,4 GB,LG Optimus L5 II สมาร์ทโฟนแอนดรอยด์ 4.1.2 Jelly Bean มาพร้อมหน้าจอ IPS LCD ขนาด 4 นิ้ว ความละเอียด WVGA ตัวเครื่องถูกการออกแบบให้เหมาะสมต่อการหยิบจับ มีไฟแจ้งเตือนอยู่บนปุ่ม Home สังเกตได้ง่าย สามารถเรียกใช้งานฟังก์ชั่น QuickMemo สำหรับจดบันทึกบนหน้าจอด้วยปลายนิ้วอย่างง่ายดาย แถมยังมีปุ่มลัดสำหรับเข้าถึงแอพฯ สุดโปรดได้อย่างรวดเร็ว
lg,optimus l3 ii,3490,ดำ,4 GB,LG Optimus L3 II ดีไซน์มาเพื่อตอบโจทย์การใช้งานที่หลากหลาย พร้อมขีดความสามารถที่เพิ่มขึ้น ด้วยหน้าจอกว้าง 3.2 นิ้ว เพื่อความสบายตาในการมองภาพและอ่านข้อความ และเพิ่มประสิทธิภาพด้วยหน่วยประมวลผล Single Core จอแสดงผลแบบ IPS-LCD ความละเอียด 320 x 240 พิกเซล หน้าจอกว้าง 3.2 นิ้ว นอกจากนี้ Android 4.1.2 Jelly Bean ยังช่วยเสริมประสิทธิภาพให้คุณติดต่อสื่อสารแบบมัลติมีเดียได้เต็มที่ และใช้งานฟังก์ชั่นต่างๆ ได้พร้อมกันไม่ว่าจะซับซ้อนแค่ไหน
lg,optimus g,17900,ดำ,32 GB,LG เป็นแบรนด์ที่ผลิตสร้างสรรค์โทรศัพท์มาอย่างยาวนาน ล่าสุด LG ก็ได้ผลิตและสร้างสรรค์ LG Optimus G ซึ่งเป็นโทรศัพท์มือถือที่จะมาช่วยเติมเต็มโลกแห่งการสื่อสารของคุณให้ง่ายยิ่งขึ้น ฟังก์ชั่น Q Slide จะช่วยให้คุณเปิดโปรแกรมทำงานหลายอย่างในเวลาเดียวกัน เพียงแค่ Slide ก็เลือกหน้าจอที่ต้องการใช้งานได้ทันที ไม่ว่าจะเป็นบราวน์เซอร์  เครื่องคิดเลข  บันทึกส่วนตัว (Memo)  ปฏิทิน หรือวิดีโอ โดยคุณสามารถแชทกับเพื่อนไปพร้อมกับดูวิดีโอโดยไม่จำเป็นต้องย่อหน้าจอใดหน้าจอหนึ่ง หรือ ค้นหาข้อมูลในเว็บในขณะที่กำลังดูวิดีโอก็สามารถทำได้
lg,lg nexus 4,14900,ดำ,16 GB,มาวันนี้เป็นคิวของ Google Nexus 4 สมาร์ตโฟนเรือธงฝั่ง Android ที่หนนี้ได้บริษัท LG ซึ่งโดดเด่นในด้านงานดีไซน์มาเป็นผู้ร่วมทุนสร้างด้วย แน่นอนว่าความโดดเด่นใน Google Nexus 4 by LG ยังมีอยู่อย่างครบครันในฐานะที่เป็นสมาร์ตโฟนโชว์เคสระบบปฏิบัติการ Android 4.2 Jelly Bean เวอร์ชันใหม่นั่นเอง แต่ในขณะเดียวกัน Google Nexus 4 by LG ก็ได้ทิ้งภาพความเป็นมือถือสำหรับ Geek แบบจ๋าๆแล้วหันไปให้ความสำคัญกับดีไซน์ที่โฉบเฉี่ยวดูดีมีสไตล์ตามปรัชญา Fashionista ของค่าย LG อีกด้วย
nokia,lumia 625,6990,ขาว:ดำ:ส้ม:เขียว:เหลือง,8 GB,Nokia Lumia 625 วินโดวส์โฟนที่เต็มเปี่ยมไปด้วยคุณภาพ เป็นอีกตัวเลือกสำหรับผู้ที่อยากจะลองใช้งานสมาร์ทโฟน ระบบปฏิบัติการ Windows Phone 8 มาพร้อมกระจกกันรอยขีดข่วน Gorilla Glass 2 และรูปทรงที่น่าใช้ สีสันโดนใจ ฝาหลังสุดจี๊ดสดใส สามารถถอดเปลี่ยนฝาหลังเป็นสีอื่นๆ ได้ตามชอบใจ และด้วยคุณบัติเจ๋งๆ ที่เมื่อคุณได้ใช้แล้วจะต้องหลงรัก Nokia Lumia อย่างแน่นอน
nokia,lumia 1020,19900,ขาว:ดำ:เหลือง,32 GB,สมาร์ทโฟนที่ได้ขึ้นชื่อว่าเป็นราชาแห่งกล้องสมาร์ทโฟนในขณะนี้เลยก็ว่าได้ และจะเป็นอะไรไปไม่ได้นอกจากเจ้า Nokia Lumia 1020 ที่มาพร้อมกับกล้องเซ็นเซอร์ความละเอียด 41 ล้านพิกเซล วิดีโอแบบ Full HD OMG !! ชัดระดับเทพ ยังแถมฟีเจอร์อีกมากมายที่ช่วยให้เราสามารถถ่ายภาพกันได้แบบมืออาชีพ ไม่ว่าจะเป็น Nokia Pro Camera  Nokia Smart Camera และอีกมากมาย
nokia,lumia 925,12500,ขาว:ดำ:เทา,16 GB,Nokia Lumia 925 มาพร้อมคุณสมบัติที่ยอดเยี่ยม ทำงานบนระบบปฏิบัติการ Windows Phone 8 คล่องตัวกับการทำงานได้ทุกที่กับ MS Office และสำรวจรอบเมืองด้วย HERE Maps ภาพและวิดีโอคมชัดได้อย่างน่าทึ่งแม้มีแสงน้อย ด้วยโหมด Nokia Smart Cam จะเก็บภาพถ่ายแบบต่อเนื่อง ให้คุณสร้าง เรื่องราวที่คุณต้องการบอกเล่าผ่านภาพถ่ายได้  กล้องขนาด 8.7 ล้านพิกเซล พร้อมเทคโนโลยี PureView พร้อมเลนส์ Carl Zeiss หกชิ้น ตัวเครื่องเป็นอลูมิเนียมแบบเพรียวบาง และมีน้ำหนักเบา พร้อมหน้าจอ 4.5 นิ้ว HD+
nokia,asha 501,2690,ขาว:ดำ:เขียว:เหลือง:แดง:ฟ้า,4 GB,สำหรับ Nokia Asha501 เจ้า Smartphone ไซส์มินิตัวนี้ จากทางค่าย Nokia เห็นตัวเล็กๆแบบนี้ มันสามารถทำอะไรได้บ้าง ไปดูกันเลย Nokia Asha501 ใช้ระบบปฏิบัติการ Asha Platform หน้าจอขนาด 3 นิ้ว ความละเอียด 320x240 พิกเซล หน่วยความจำภายใน 4GB สามารถเพิ่ม microSD card ได้สูงสุด 32GB และน้ำหนักเพียง 98 กรัม กะไปประมาณ 1 ขีดละกัน เบามว้ากกกกกก
nokia,301,2630,เหลือง:ขาว:ชมพู:ฟ้า:ดำ,ไม่มี/ไม่มีข้อมูล,ทำให้ชีวิตง่ายขึ้นด้วย Nokia 301 ที่ซิงค์รายชื่อติดต่อ ปฏิทิน และอีเมลด้วย Mail for Exchange ส่งอีเมลได้รวดเร็วสุดๆ ด้วยแอพ Yahoo! Gmail และ Hotmail ที่พร้อมให้คุณใช้งานทันที ด้วยแอพที่ติดตั้งเป็นมาตรฐานทั้ง Facebook และ Twitter หากคุณเป็นคนชอบแชท WhatsApp และ eBuddy จะช่วยให้คุณรับส่งข้อความได้เร็วทันใจจากปลายนิ้ว
nokia,105,630,ดำ:ฟ้า,8 GB,ตอบสนองยุคแห่งการติดต่อสื่อสาร ด้วย Nokia 105 โทรศัพท์มือถือที่ยังคงเป็นตัวเลือกอันดับแรกในใจคุณเสมอ ด้วยดีไซน์ที่เรียบง่าย ปุ่มกดใช้งานแบบที่คุณคุ้นเคย ตัวเครื่องแข็งแรงทนทาน แบตเตอรี่ใช้งานได้ยาวนาน คุณจึงไม่พลาดทุกการสนทนา นี่คือหนึ่งในทางเลือกสุดคุ้มสำหรับผู้บริโภคที่กำลังตามหาความคุ้มค่าที่หายากยิ่งในปัจจุบัน
